{
  "accepted_at": null,
  "id": "deepseek-v4-flash-iq2-xxs-rtx-3090-24gb-llama-cpp-tp1-sweep",
  "measured_at": "2026-07-03T16:24:55.207Z",
  "recipe_id": "deepseek-v4-flash-iq2-xxs-rtx-3090-24gb-llama-cpp-tp1",
  "rows": [
    {
      "concurrency": 2048,
      "context_tokens": 26652,
      "decode_tok_s": 11,
      "decode_tok_s_per_stream": null,
      "output_tokens": 256,
      "peak_vram_gb": 23.3,
      "prefill_tok_s": 20,
      "samples": 1,
      "status": "observed",
      "ttft_ms_p50": 97914
    }
  ],
  "schema_version": "local-ai-registry/v1",
  "source": {
    "commit": null,
    "kind": "leaderboard",
    "paths": [
      "/en/runs/cmr559a5j006fq901g8dfviyz"
    ],
    "repository": "https://www.localmaxxing.com",
    "url": "https://www.localmaxxing.com/en/runs/cmr559a5j006fq901g8dfviyz"
  }
}
