{
  "accepted_at": null,
  "id": "qwen2-5-coder-7b-q4-k-m-rtx-3060-12gb-ollama-tp1-sweep",
  "measured_at": "2026-05-13T21:36:41.133Z",
  "recipe_id": "qwen2-5-coder-7b-q4-k-m-rtx-3060-12gb-ollama-tp1",
  "rows": [
    {
      "concurrency": 1,
      "context_tokens": 2048,
      "decode_tok_s": 119,
      "decode_tok_s_per_stream": null,
      "output_tokens": 0,
      "peak_vram_gb": 4.7,
      "prefill_tok_s": null,
      "samples": 1,
      "status": "observed",
      "ttft_ms_p50": null
    }
  ],
  "schema_version": "local-ai-registry/v1",
  "source": {
    "commit": null,
    "kind": "leaderboard",
    "paths": [
      "/en/runs/cmp4kxrql000uql01gysfsyku"
    ],
    "repository": "https://www.localmaxxing.com",
    "url": "https://www.localmaxxing.com/en/runs/cmp4kxrql000uql01gysfsyku"
  }
}
