{
  "accepted_at": null,
  "id": "qwen3-8-27b-q6-k-intel-arc-pro-b70-32gb-llama-cpp-tp1-sweep",
  "measured_at": "2026-08-17T21:38:07.887Z",
  "recipe_id": "qwen3-8-27b-q6-k-intel-arc-pro-b70-32gb-llama-cpp-tp1",
  "rows": [
    {
      "concurrency": 1,
      "context_tokens": 2048,
      "decode_tok_s": 27.4,
      "decode_tok_s_per_stream": null,
      "output_tokens": 400,
      "peak_vram_gb": null,
      "prefill_tok_s": 518.9,
      "samples": 1,
      "status": "observed",
      "ttft_ms_p50": 142.6
    }
  ],
  "schema_version": "local-ai-registry/v1",
  "source": {
    "commit": null,
    "kind": "leaderboard",
    "paths": [
      "/en/runs/cmsxr9eof0ch4ms01vqtnxaqs"
    ],
    "repository": "https://www.localmaxxing.com",
    "url": "https://www.localmaxxing.com/en/runs/cmsxr9eof0ch4ms01vqtnxaqs"
  }
}
