{
  "accepted_at": null,
  "id": "mellum2-12b-a2-5b-instruct-q4-k-m-rtx-5070-12gb-llama-cpp-tp1-sweep",
  "measured_at": "2026-07-04T23:48:54.513Z",
  "recipe_id": "mellum2-12b-a2-5b-instruct-q4-k-m-rtx-5070-12gb-llama-cpp-tp1",
  "rows": [
    {
      "concurrency": 1,
      "context_tokens": 2048,
      "decode_tok_s": 261.41,
      "decode_tok_s_per_stream": null,
      "output_tokens": 128,
      "peak_vram_gb": null,
      "prefill_tok_s": 7526.29,
      "samples": 1,
      "status": "observed",
      "ttft_ms_p50": 68
    }
  ],
  "schema_version": "local-ai-registry/v1",
  "source": {
    "commit": null,
    "kind": "leaderboard",
    "paths": [
      "/en/runs/cmr70k3u900j4mn01lyejcnis"
    ],
    "repository": "https://www.localmaxxing.com",
    "url": "https://www.localmaxxing.com/en/runs/cmr70k3u900j4mn01lyejcnis"
  }
}
