{
  "accepted_at": null,
  "id": "glm-5-3-flash-awq-4bit-rtx-3090-24gb-vllm-tp8-sweep",
  "measured_at": "2026-08-29T11:47:56.750Z",
  "recipe_id": "glm-5-3-flash-awq-4bit-rtx-3090-24gb-vllm-tp8",
  "rows": [
    {
      "concurrency": 1,
      "context_tokens": 204800,
      "decode_tok_s": 75.2,
      "decode_tok_s_per_stream": null,
      "output_tokens": 512,
      "peak_vram_gb": 183.43,
      "prefill_tok_s": 1020,
      "samples": 1,
      "status": "observed",
      "ttft_ms_p50": 357.8
    }
  ],
  "schema_version": "local-ai-registry/v1",
  "source": {
    "commit": null,
    "kind": "leaderboard",
    "paths": [
      "/en/runs/cmtebgn9q006clm01eray6kbm"
    ],
    "repository": "https://www.localmaxxing.com",
    "url": "https://www.localmaxxing.com/en/runs/cmtebgn9q006clm01eray6kbm"
  }
}
