{
  "accepted_at": null,
  "id": "qwen3-6-27b-q8-0-rtx-5090-32gb-ollama-tp1-sweep",
  "measured_at": "2026-06-27T03:28:02.772Z",
  "recipe_id": "qwen3-6-27b-q8-0-rtx-5090-32gb-ollama-tp1",
  "rows": [
    {
      "concurrency": 1,
      "context_tokens": 2048,
      "decode_tok_s": 20,
      "decode_tok_s_per_stream": null,
      "output_tokens": 512,
      "peak_vram_gb": 16,
      "prefill_tok_s": 1200,
      "samples": 1,
      "status": "observed",
      "ttft_ms_p50": 200
    }
  ],
  "schema_version": "local-ai-registry/v1",
  "source": {
    "commit": null,
    "kind": "leaderboard",
    "paths": [
      "/en/runs/cmqvsv3rn02ylqr0134tdp4f2"
    ],
    "repository": "https://www.localmaxxing.com",
    "url": "https://www.localmaxxing.com/en/runs/cmqvsv3rn02ylqr0134tdp4f2"
  }
}
