{
  "accepted_at": "2026-08-23",
  "id": "deepseek-v4-flash-dspark-nvfp4-dgxspark-vllm-tp2-sweep",
  "measured_at": "2026-08-23",
  "recipe_id": "deepseek-v4-flash-dspark-nvfp4-dgxspark-vllm-tp2",
  "rows": [
    {
      "concurrency": 1,
      "context_tokens": null,
      "decode_tok_s": 66.6,
      "decode_tok_s_per_stream": 66.6,
      "output_tokens": 512,
      "peak_vram_gb": null,
      "prefill_tok_s": null,
      "samples": 3,
      "status": "historical",
      "ttft_ms_p50": null
    },
    {
      "concurrency": 2,
      "context_tokens": null,
      "decode_tok_s": 93.3,
      "decode_tok_s_per_stream": 47.2,
      "output_tokens": 512,
      "peak_vram_gb": null,
      "prefill_tok_s": null,
      "samples": 3,
      "status": "historical",
      "ttft_ms_p50": null
    },
    {
      "concurrency": 3,
      "context_tokens": null,
      "decode_tok_s": 92.8,
      "decode_tok_s_per_stream": 31.9,
      "output_tokens": 512,
      "peak_vram_gb": null,
      "prefill_tok_s": null,
      "samples": 3,
      "status": "historical",
      "ttft_ms_p50": null
    },
    {
      "concurrency": 4,
      "context_tokens": null,
      "decode_tok_s": 123.8,
      "decode_tok_s_per_stream": 32.8,
      "output_tokens": 512,
      "peak_vram_gb": null,
      "prefill_tok_s": null,
      "samples": 3,
      "status": "historical",
      "ttft_ms_p50": null
    },
    {
      "concurrency": 5,
      "context_tokens": null,
      "decode_tok_s": 121.1,
      "decode_tok_s_per_stream": 25.7,
      "output_tokens": 512,
      "peak_vram_gb": null,
      "prefill_tok_s": null,
      "samples": 3,
      "status": "historical",
      "ttft_ms_p50": null
    },
    {
      "concurrency": 6,
      "context_tokens": null,
      "decode_tok_s": 153.7,
      "decode_tok_s_per_stream": 26.8,
      "output_tokens": 512,
      "peak_vram_gb": null,
      "prefill_tok_s": null,
      "samples": 3,
      "status": "historical",
      "ttft_ms_p50": null
    }
  ],
  "schema_version": "local-ai-registry/v1",
  "source": {
    "commit": "b4cc551b0adb6aa62979d92686b9fe0f1326d640",
    "paths": [
      "docker-compose.dspark.yml",
      ".env.dspark.example",
      "start-deepseek-v4-flash-dspark.sh",
      "README.md"
    ],
    "repository": "https://github.com/0xSero/DeepSeek-v4-Flash-DSpark-2x-DGX-Spark"
  }
}
