{
  "accepted_at": null,
  "id": "llama-3-2-3b-instruct-q4-k-m-rtx-3060-12gb-llama-cpp-tp1-sweep",
  "measured_at": "2026-07-24T03:51:56.228Z",
  "recipe_id": "llama-3-2-3b-instruct-q4-k-m-rtx-3060-12gb-llama-cpp-tp1",
  "rows": [
    {
      "concurrency": 1,
      "context_tokens": 512,
      "decode_tok_s": 128.08,
      "decode_tok_s_per_stream": null,
      "output_tokens": 128,
      "peak_vram_gb": null,
      "prefill_tok_s": 4321.8,
      "samples": 1,
      "status": "observed",
      "ttft_ms_p50": 174.5
    }
  ],
  "schema_version": "local-ai-registry/v1",
  "source": {
    "commit": null,
    "kind": "leaderboard",
    "paths": [
      "/en/runs/cmryelttw02yso401j2xh5tkv"
    ],
    "repository": "https://www.localmaxxing.com",
    "url": "https://www.localmaxxing.com/en/runs/cmryelttw02yso401j2xh5tkv"
  }
}
