{
  "accepted_at": null,
  "id": "nvidia-nemotron-3-nano-30b-a3b-bf16-nvfp4-rtx-5090-32gb-vllm-tp1-sweep",
  "measured_at": "2026-07-23",
  "recipe_id": "nvidia-nemotron-3-nano-30b-a3b-bf16-nvfp4-rtx-5090-32gb-vllm-tp1",
  "rows": [
    {
      "concurrency": 1,
      "context_tokens": 2048,
      "decode_tok_s": 582.5,
      "decode_tok_s_per_stream": null,
      "output_tokens": 256,
      "peak_vram_gb": null,
      "prefill_tok_s": 121,
      "samples": 1,
      "status": "historical",
      "ttft_ms_p50": 322.34
    }
  ],
  "schema_version": "local-ai-registry/v1",
  "source": {
    "commit": null,
    "paths": null,
    "repository": "https://www.localmaxxing.com"
  }
}
