{
  "accepted_at": null,
  "id": "qwen3-6-35b-a3b-mq4r-rx-7900-xtx-24gb-hipfire-tp1-sweep",
  "measured_at": "2026-08-10T20:39:44.293Z",
  "recipe_id": "qwen3-6-35b-a3b-mq4r-rx-7900-xtx-24gb-hipfire-tp1",
  "rows": [
    {
      "concurrency": 1,
      "context_tokens": 4096,
      "decode_tok_s": 494.65,
      "decode_tok_s_per_stream": null,
      "output_tokens": 256,
      "peak_vram_gb": null,
      "prefill_tok_s": 1467.82,
      "samples": 1,
      "status": "observed",
      "ttft_ms_p50": 520.5
    }
  ],
  "schema_version": "local-ai-registry/v1",
  "source": {
    "commit": null,
    "kind": "leaderboard",
    "paths": [
      "/en/runs/cmsnp3cmd00nyo001yvkgm3tq"
    ],
    "repository": "https://www.localmaxxing.com",
    "url": "https://www.localmaxxing.com/en/runs/cmsnp3cmd00nyo001yvkgm3tq"
  }
}
