{
  "accepted_at": null,
  "id": "ornstein3-6-27b-mtp-nsc-ace-saber-rocmfp4-ryzen-ai-max-plus-395-128gb-llama-cpp-tp1-sweep",
  "measured_at": "2026-06-07T19:13:44.157Z",
  "recipe_id": "ornstein3-6-27b-mtp-nsc-ace-saber-rocmfp4-ryzen-ai-max-plus-395-128gb-llama-cpp-tp1",
  "rows": [
    {
      "concurrency": 32768,
      "context_tokens": 262144,
      "decode_tok_s": 49.5,
      "decode_tok_s_per_stream": null,
      "output_tokens": 93,
      "peak_vram_gb": null,
      "prefill_tok_s": 264.16,
      "samples": 1,
      "status": "observed",
      "ttft_ms_p50": null
    }
  ],
  "schema_version": "local-ai-registry/v1",
  "source": {
    "commit": null,
    "kind": "leaderboard",
    "paths": [
      "/en/runs/cmq45u8d8003umu01scv0irgo"
    ],
    "repository": "https://www.localmaxxing.com",
    "url": "https://www.localmaxxing.com/en/runs/cmq45u8d8003umu01scv0irgo"
  }
}
