{
  "accepted_at": null,
  "id": "gemma-4-e2b-it-q8-k-xl-apple-m5-pro-24gb-llama-cpp-tp1-sweep",
  "measured_at": "2026-07-01T11:14:17.806Z",
  "recipe_id": "gemma-4-e2b-it-q8-k-xl-apple-m5-pro-24gb-llama-cpp-tp1",
  "rows": [
    {
      "concurrency": 1,
      "context_tokens": 4224,
      "decode_tok_s": 77.41,
      "decode_tok_s_per_stream": null,
      "output_tokens": 124,
      "peak_vram_gb": null,
      "prefill_tok_s": 2543.25,
      "samples": 1,
      "status": "observed",
      "ttft_ms_p50": 201.32
    }
  ],
  "schema_version": "local-ai-registry/v1",
  "source": {
    "commit": null,
    "kind": "leaderboard",
    "paths": [
      "/en/runs/cmr1za43x01ocld0173wikwr8"
    ],
    "repository": "https://www.localmaxxing.com",
    "url": "https://www.localmaxxing.com/en/runs/cmr1za43x01ocld0173wikwr8"
  }
}
