{
  "accepted_at": null,
  "id": "qwen3-0-6b-base-q4-k-m-rtx-3060-ti-8gb-llama-cpp-tp1-sweep",
  "measured_at": "2026-07-27T18:55:03.158Z",
  "recipe_id": "qwen3-0-6b-base-q4-k-m-rtx-3060-ti-8gb-llama-cpp-tp1",
  "rows": [
    {
      "concurrency": 1,
      "context_tokens": 512,
      "decode_tok_s": 370.26,
      "decode_tok_s_per_stream": null,
      "output_tokens": 128,
      "peak_vram_gb": 5.16,
      "prefill_tok_s": 15047.57,
      "samples": 1,
      "status": "observed",
      "ttft_ms_p50": 54.3
    }
  ],
  "schema_version": "local-ai-registry/v1",
  "source": {
    "commit": null,
    "kind": "leaderboard",
    "paths": [
      "/en/runs/cms3l6sqe017zs201dl4y2cl9"
    ],
    "repository": "https://www.localmaxxing.com",
    "url": "https://www.localmaxxing.com/en/runs/cms3l6sqe017zs201dl4y2cl9"
  }
}
