{
  "accepted_at": null,
  "id": "gpt-oss-120b-f16-ryzen-ai-max-plus-395-128gb-llama-cpp-tp1-sweep",
  "measured_at": "2026-07-11T00:38:43.232Z",
  "recipe_id": "gpt-oss-120b-f16-ryzen-ai-max-plus-395-128gb-llama-cpp-tp1",
  "rows": [
    {
      "concurrency": 1,
      "context_tokens": 845,
      "decode_tok_s": 38.828,
      "decode_tok_s_per_stream": null,
      "output_tokens": 256,
      "peak_vram_gb": null,
      "prefill_tok_s": 342.745,
      "samples": 1,
      "status": "observed",
      "ttft_ms_p50": 1718.48
    }
  ],
  "schema_version": "local-ai-registry/v1",
  "source": {
    "commit": null,
    "kind": "leaderboard",
    "paths": [
      "/en/runs/cmrfmz9y700b9qd01bkdgwe4k"
    ],
    "repository": "https://www.localmaxxing.com",
    "url": "https://www.localmaxxing.com/en/runs/cmrfmz9y700b9qd01bkdgwe4k"
  }
}
