{
  "accepted_at": null,
  "id": "gemma-4-e4b-it-4bit-apple-m5-max-128gb-lmstudio-tp1-sweep",
  "measured_at": "2026-05-03T18:51:05.101Z",
  "recipe_id": "gemma-4-e4b-it-4bit-apple-m5-max-128gb-lmstudio-tp1",
  "rows": [
    {
      "concurrency": 1,
      "context_tokens": 8192,
      "decode_tok_s": 91.398,
      "decode_tok_s_per_stream": null,
      "output_tokens": 255,
      "peak_vram_gb": null,
      "prefill_tok_s": null,
      "samples": 1,
      "status": "observed",
      "ttft_ms_p50": 154
    }
  ],
  "schema_version": "local-ai-registry/v1",
  "source": {
    "commit": null,
    "kind": "leaderboard",
    "paths": [
      "/en/runs/cmoq4madp000pk1047c2723wj"
    ],
    "repository": "https://www.localmaxxing.com",
    "url": "https://www.localmaxxing.com/en/runs/cmoq4madp000pk1047c2723wj"
  }
}
